{
  "$schema": "T01_PHASE1_MOCK_FREEZE_MANIFEST_SCHEMA_v0.1.json",
  "document_type": "T01_PHASE1_MOCK_FREEZE_MANIFEST",
  "manifest_version": "T01-PHASE1-MOCK-FREEZE-MANIFEST-v0.1",
  "release_id": "T01-PHASE1-MOCK-v0.1",
  "release_state": "FROZEN",
  "frozen_at": "2026-09-04T14:18:00.001308Z",
  "campaign_id": "t01p1m-v01-reg-20260904-release-freeze-03",
  "binding_profile": "local_dify_1_17",
  "m4_result": {
    "path": "dify/t01-phase1-mock-v0.1/regression/runs/t01p1m-v01-reg-20260904-release-freeze-03/T01_PHASE1_MOCK_M4_REGRESSION_RESULT_v0.1.json",
    "bytes": 96897,
    "sha256": "e7730722034c9f8c15bf11394b3062744450e315f10012a7cd783c4b21701f6f"
  },
  "regression_partitions": {
    "path": "dify/t01-phase1-mock-v0.1/regression/runs/t01p1m-v01-reg-20260904-release-freeze-03/regression-partitions.json",
    "status": "PASS",
    "documentation_markdown_count": 115,
    "current_phase1_test_count": 185,
    "legacy_full_mock_test_count": 74,
    "legacy_s07_test_count": 41
  },
  "frozen_asset_count": 457,
  "frozen_assets": [
    {
      "path": "dify/t01-phase1-mock-v0.1/bound/local_dify_1_17/T01_Phase1_Mock_v0.1.bound.dify.yml",
      "bytes": 70380,
      "sha256": "c1bcbb1f2a156d79ac3fcd592c08e5415ca5b671c2e47c339672c11567b48fa6"
    },
    {
      "path": "dify/t01-phase1-mock-v0.1/bound/local_dify_1_17/T01_Phase1_Mock_v0.1_Debug.bound.dify.yml",
      "bytes": 70386,
      "sha256": "d7883fbc19ff6aa66a875e7fb60f88be2ce46945c4b919c4057332f71752ad1b"
    },
    {
      "path": "dify/t01-phase1-mock-v0.1/config/T01_PHASE1_MOCK_PROVIDER_BINDING_SCHEMA_v0.1.json",
      "bytes": 1869,
      "sha256": "9b68642bba9b4e16c9afdf4661b38d894d12d994b65fd1fbf9219b7cb6ebb99e"
    },
    {
      "path": "dify/t01-phase1-mock-v0.1/config/provider-bindings.local_dify_1_17.json",
      "bytes": 2129,
      "sha256": "025d5859b01befbc77540a4d32a0ef01479c34484af481a615cf8b126395855a"
    },
    {
      "path": "dify/t01-phase1-mock-v0.1/evidence/m3/local_dify_1_17/T01_PHASE1_MOCK_M3_ACCEPTANCE_RESULT_SCHEMA_v0.1.json",
      "bytes": 10659,
      "sha256": "4fa833b30d3a1f66c1bdbe89acbb08698025a804649138fc564460f561e64262"
    },
    {
      "path": "dify/t01-phase1-mock-v0.1/evidence/m3/local_dify_1_17/T01_PHASE1_MOCK_M3_ACCEPTANCE_RESULT_v0.1.json",
      "bytes": 83256,
      "sha256": "beab3f007e2450af6bfa7be6d78ca5d04e31e0e1485f956067470d188b2bff7b"
    },
    {
      "path": "dify/t01-phase1-mock-v0.1/evidence/m3/local_dify_1_17/binding-evidence.json",
      "bytes": 981,
      "sha256": "09f67a427c26c5a54b860bececa43269cf7f0baf647b9ec43fbc2cec227b2adc"
    },
    {
      "path": "dify/t01-phase1-mock-v0.1/evidence/m3/local_dify_1_17/execution-manifest.json",
      "bytes": 3341,
      "sha256": "c1891313170f2ece700bcaffa320ee50aafc78eaeb8d9e6af0df5d0de44e50ea"
    },
    {
      "path": "dify/t01-phase1-mock-v0.1/evidence/m3/local_dify_1_17/import-evidence.json",
      "bytes": 7278,
      "sha256": "a46f64283a0ec43d886075c1adc99580ff6d52f63bb6f1cda7f135ae26edabf8"
    },
    {
      "path": "dify/t01-phase1-mock-v0.1/evidence/m3/local_dify_1_17/target-preflight.json",
      "bytes": 3151,
      "sha256": "9bb9994b8c6927afb7f08c3cf5b87aa72ee5865f22335cc14c39663ee4ffa189"
    },
    {
      "path": "dify/t01-phase1-mock-v0.1/fixtures/T01_PHASE1_MOCK_FIXTURE_MANIFEST_SCHEMA_v0.1.json",
      "bytes": 18682,
      "sha256": "2e3917f9473698d30549522058086298414b0642707a1cc2deab2bbe1f821fae"
    },
    {
      "path": "dify/t01-phase1-mock-v0.1/fixtures/T01_PHASE1_MOCK_FIXTURE_MANIFEST_v0.1.json",
      "bytes": 45464,
      "sha256": "b044a1c4c1d44e8c734c4c4df3bace48bdace2c87d9fe1dd77f6eede41e72c9a"
    },
    {
      "path": "dify/t01-phase1-mock-v0.1/fixtures/T01_PHASE1_MOCK_FIXTURE_MATERIALIZATION_SCHEMA_v0.1.json",
      "bytes": 3803,
      "sha256": "88b1e7c9816c8f16cda716e6dc1946db7c1f88c5de641ae8e1ea8bc8406fe56f"
    },
    {
      "path": "dify/t01-phase1-mock-v0.1/fixtures/T01_PHASE1_MOCK_FIXTURE_MATERIALIZATION_v0.1.json",
      "bytes": 165539,
      "sha256": "5bf3a11649c97e9051798dda44dc59d12f0d98998f2a2ecab08463e29cc622ae"
    },
    {
      "path": "dify/t01-phase1-mock-v0.1/fixtures/inputs/input.synthetic.no_structure.json",
      "bytes": 626,
      "sha256": "59e63a7d6b0b12de54e935b18ee69a401a958abe52a53843046db8acca8a3ad8"
    },
    {
      "path": "dify/t01-phase1-mock-v0.1/fixtures/inputs/input.synthetic.standard.json",
      "bytes": 1698,
      "sha256": "8613f5cee638098df1b5a47d980165787c7a6219d4c7042b3fd37334e5eac239"
    },
    {
      "path": "dify/t01-phase1-mock-v0.1/fixtures/node-results/gate_wt_direct/n01/attempt-1.json",
      "bytes": 733,
      "sha256": "3f797747e874da74cae0f02782f8509b3a7d431fd106c8e94af9d2730bd461a1"
    },
    {
      "path": "dify/t01-phase1-mock-v0.1/fixtures/node-results/gate_wt_direct/n02/attempt-1.json",
      "bytes": 675,
      "sha256": "07d6122e412b597316652c57ebce7bd3bdb34030e2960d16f9bc2643e7290575"
    },
    {
      "path": "dify/t01-phase1-mock-v0.1/fixtures/node-results/gate_wt_direct/n03/attempt-1.json",
      "bytes": 685,
      "sha256": "bf0996acc00e141890a7a196d4f6859a50182170d8cc0ce50a1be405871f0160"
    },
    {
      "path": "dify/t01-phase1-mock-v0.1/fixtures/node-results/gate_wt_direct/n04/attempt-1.json",
      "bytes": 633,
      "sha256": "d1404f7e7e72cafe2215fba5bc01332599307f032726faef5ba9c9a23f2e7ea3"
    },
    {
      "path": "dify/t01-phase1-mock-v0.1/fixtures/node-results/gate_wt_direct/n05/attempt-1.json",
      "bytes": 706,
      "sha256": "04e03df2c43ae173199052579523fb298f5431a6067f06a7bea237ad167c5e08"
    },
    {
      "path": "dify/t01-phase1-mock-v0.1/fixtures/node-results/gate_wt_direct/n06/attempt-1.json",
      "bytes": 684,
      "sha256": "2358cf3de93c0c26d0e55593383efd7ac77c2f3ed7e84589d1f68009fb1e6eb2"
    },
    {
      "path": "dify/t01-phase1-mock-v0.1/fixtures/node-results/gate_wt_direct/n07/attempt-1.json",
      "bytes": 666,
      "sha256": "4405d443e6ea5ae0a110dfdc2770468da466627092aca2a2f348aac40d2c0a8a"
    },
    {
      "path": "dify/t01-phase1-mock-v0.1/fixtures/node-results/gate_wt_direct/n08/attempt-1.json",
      "bytes": 701,
      "sha256": "5a915cdabede40064dee8b3735faf54f0dc15aa2efe26a236e774f1180bbd7a6"
    },
    {
      "path": "dify/t01-phase1-mock-v0.1/fixtures/node-results/gate_wt_direct/n09/attempt-1.json",
      "bytes": 643,
      "sha256": "9a70b277ca754c2a4f63272dbb8a0134d77139659314a1cf508d908be4769236"
    },
    {
      "path": "dify/t01-phase1-mock-v0.1/fixtures/node-results/gate_wt_direct/n10/attempt-1.json",
      "bytes": 722,
      "sha256": "dd5885520e097c14592983564c02a661ae9d153b281fe121cc7680498f3919e2"
    },
    {
      "path": "dify/t01-phase1-mock-v0.1/fixtures/node-results/gate_wt_direct/n18/attempt-1.json",
      "bytes": 747,
      "sha256": "69e648d4b20b2af6afa3b92a13fac333cb761561b5da5d76a49c5bafe22d4eac"
    },
    {
      "path": "dify/t01-phase1-mock-v0.1/fixtures/node-results/happy_no_structure_local_af3/n01/attempt-1.json",
      "bytes": 797,
      "sha256": "8709b2025489cf50fc3d632409c52757fdc5d81318369ee1038195f8f2e01824"
    },
    {
      "path": "dify/t01-phase1-mock-v0.1/fixtures/node-results/happy_no_structure_local_af3/n02/attempt-1.json",
      "bytes": 731,
      "sha256": "15a6de656e5b6b93bcd2b577ed8866ba2d467cbba5f65f86f93795ac1fa082a9"
    },
    {
      "path": "dify/t01-phase1-mock-v0.1/fixtures/node-results/happy_no_structure_local_af3/n03/attempt-1.json",
      "bytes": 741,
      "sha256": "3f15dc3f9b5c468b1271fe8d4fc70cf6cd3f2a9df608699494fee81847e2a66b"
    },
    {
      "path": "dify/t01-phase1-mock-v0.1/fixtures/node-results/happy_no_structure_local_af3/n04/attempt-1.json",
      "bytes": 689,
      "sha256": "67c38cf1f3ed29342ac95d2a7f074c7f3a8bb2a04f54ddb42305c2db464fa333"
    },
    {
      "path": "dify/t01-phase1-mock-v0.1/fixtures/node-results/happy_no_structure_local_af3/n05/attempt-1.json",
      "bytes": 762,
      "sha256": "0a8eabd63442ef55d765a3dc66fb4e37e010ae45fa93e0db6941343707ec9d0a"
    },
    {
      "path": "dify/t01-phase1-mock-v0.1/fixtures/node-results/happy_no_structure_local_af3/n06/attempt-1.json",
      "bytes": 740,
      "sha256": "2613d2d739f6f82a0a047b6b212b4b45c3b1d595948869541b3bc90a6a6319d6"
    },
    {
      "path": "dify/t01-phase1-mock-v0.1/fixtures/node-results/happy_no_structure_local_af3/n07/attempt-1.json",
      "bytes": 722,
      "sha256": "2507955ddd34c7f67ebfda4c09d3b3ceaeb00187d360a77e1ba144607558909a"
    },
    {
      "path": "dify/t01-phase1-mock-v0.1/fixtures/node-results/happy_no_structure_local_af3/n08/attempt-1.json",
      "bytes": 757,
      "sha256": "e2434861b07ba34e3f3c5564a2ddef63e6579590c233a24642cdb90cd8bae9fb"
    },
    {
      "path": "dify/t01-phase1-mock-v0.1/fixtures/node-results/happy_no_structure_local_af3/n09/attempt-1.json",
      "bytes": 699,
      "sha256": "eafac5a295745ac695015f4f053cb959efc7e800b00d8c712fa5a5b0e39a5abc"
    },
    {
      "path": "dify/t01-phase1-mock-v0.1/fixtures/node-results/happy_no_structure_local_af3/n10/attempt-1.json",
      "bytes": 778,
      "sha256": "9453d1ef7952a1e070012d83cf1520958fd9e59602128ce569a9bd892fc9a0f2"
    },
    {
      "path": "dify/t01-phase1-mock-v0.1/fixtures/node-results/happy_no_structure_local_af3/n11/attempt-1.json",
      "bytes": 768,
      "sha256": "abde420397c6d096ffde138a3368855556af3514f3086d4d9597657599510b97"
    },
    {
      "path": "dify/t01-phase1-mock-v0.1/fixtures/node-results/happy_no_structure_local_af3/n12/attempt-1.json",
      "bytes": 823,
      "sha256": "58f98ee32f962e7be2b746e411f33d074206f6b92543b2a6365720504ab55c2b"
    },
    {
      "path": "dify/t01-phase1-mock-v0.1/fixtures/node-results/happy_no_structure_local_af3/n13/attempt-1.json",
      "bytes": 794,
      "sha256": "43996cae7a26fb8f3d69519dfcb6ad760427ce8e9a029d51564ee7ecfd8a77cb"
    },
    {
      "path": "dify/t01-phase1-mock-v0.1/fixtures/node-results/happy_no_structure_local_af3/n14/attempt-1.json",